Chapter,PageStart,Verse,Text
XI,170,33a,"Then the buddhas each took one great bodhisattva as an attendant and arrived under a jeweled tree in the sahā world. Each jeweled tree was ﬁve hundred yojanas in height and adorned with branches, leaves, blossoms, and fruits in their proper turn. Under all these jeweled trees were lion seats ﬁve yojanas in height that were adorned with great jewels. The buddhas each sat cross-legged on these seats. They sat one after another in this way, ﬁlling the great manifold cosmos. Yet the separate forms of Śākyamuni Buddha of even one direction had not all arrived yet. At that time Śākyamuni Buddha, wanting to be able to receive all of his magically created forms, transformed and puriﬁed two hundred myriads of koṭis of nayutas of lands in each of the world-systems in the eight directions. There were no hells, hungry ghosts, animals, or asuras; and all the devas and humans were moved to other lands. In these transformed lands the earth was made of lapis lazuli and adorned with jeweled trees. These trees were ﬁve hundred yojanas in height and were adorned with branches, leaves, blossoms, and fruits in their proper turn. Under every tree was a jeweled lion seat ﬁve yojanas in height which was adorned with various jewels. There were no oceans, rivers, or great mountain kings such as Mount Mucilinda, Mount Mahāmucilinda, Mount Cakravāḍa, Mount Mahācakravāḍa, or Mount Sumeru. The lands were all made into one buddha world throughout. The jeweled earth was level and covered everywhere with jewel-studded drapes. Banners and umbrellas were set up, precious incense was burning, and heavenly jeweled ﬂowers covered the ground everywhere. Then Śākyamuni Buddha again transformed and puriﬁed two hundred myriads of koṭis of nayutas of lands in each of the eight directions so that the buddhas could come and sit. There were no hells, hungry ghosts, animals, or asuras; and the devas and humans were moved to other lands. In the transformed lands the earth was of lapis lazuli and adorned with jeweled trees. The trees were ﬁve hundred yojanas in height and were adorned with branches, leaves, blossoms, and fruits in their proper turn. Under these trees were jeweled lion seats that were ﬁve yojanas in height and decorated with great jewels. There were no oceans, rivers, or great mountain kings such as Mount Mucilinda, Mount Mahāmucilinda, Mount Cakravāḍa, Mount Mahācakravāḍa, or Mount Sumeru. The lands were all made into one buddha world throughout. The jeweled earth was level and covered everywhere with jewel-studded drapes. Banners and umbrellas were set up, precious incense was burning, and heavenly jeweled ﬂowers covered the ground everywhere. Then the magically created forms of Śākyamuni Buddha, which had been teaching the Dharma in the hundreds of thousands of myriads of koṭis of nayutas of lands in the east, equal in number to the sands of the Ganges River, gathered here. In this way all the buddhas in the ten directions gradually came until all were assembled, sitting in the eight directions. At that time these Buddha Tathāgatas ﬁlled four hundred myriads of koṭis of nayutas of lands in each direction. Then sitting on the lion seats under the jeweled trees, the buddhas each dispatched their attendants with hands full of jeweled ﬂowers to inquire after the Buddha Śākyamuni, saying: “O son of a virtuous family! You should approach the Buddha Śākyamuni on Mount Gṛdhrakūṭa and give him a greeting, saying: Are you without illness and pain and are you full of vigor and at ease; and are the assemblies of bodhisattvas and śrāvakas all at ease or not? “Then, having paid homage to the Buddha by scattering him with these jeweled ﬂowers, say this to him: The Buddha So-and-so wishes you to open this jeweled stupa. All the other buddhas dispatched their messengers like this.” Then the Buddha Śākyamuni saw that his magically created forms had already gathered and were each sitting on a lion seat. And he heard that all the buddhas also wanted him to open the treasured stupa. Immediately rising, he hovered in the air and the entire fourfold assembly rose and gazed attentively at the Buddha with their palms pressed together. Thereupon Śākyamuni Buddha opened the entrance to the seven-jeweled stupa with his right ﬁnger. There was a tremendous sound as if the bar and lock to the gateway of a large city were being pushed aside. Then immediately the entire gathering saw the Tathāgata Prabhūtaratna in the jeweled stupa sitting on a lion seat as if he were in meditation, his body whole and undecomposed. They heard him say: “Splendid, splendid! The Buddha Śākyamuni is teaching the Lotus Sutra and I have come in order to hear it.”"
XI,172,33c,"At that time the fourfold assembly saw the Buddha who had entered parinirvāṇa immeasurable thousands of myriads of koṭis of kalpas ago speaking those words. They praised this unprecedented experience and scattered heavenly jeweled ﬂowers upon the buddhas Prabhūtaratna and Śākyamuni. Then from within the stupa the Buddha Prabhūtaratna offered half of his seat to the Buddha Śākyamuni, saying: “O Śākyamuni Buddha, please take a seat here!” The Buddha Śākyamuni immediately entered the stupa and sat crosslegged on half of the seat. Thereupon the great assembly saw the two Tathāgatas sitting cross-legged on the lion seat in the seven-jeweled stupa and they each thought thus: “The buddhas are seated far away. O Tathāgata, we entreat you to use your transcendent powers so that we may be in the air together with you.” The Buddha Śākyamuni immediately moved the entire fourfold assembly into the air through his transcendent powers and addressed them with a great voice, saying: “Who in the sahā world is able to extensively teach the Lotus Sutra? It is now the right time! The Tathāgata will enter parinirvāṇa before long and the Buddha wants to transmit this Lotus Sutra to you. Thereupon the Buddha, wanting to further elaborate upon the meaning of this, spoke these verses: Although the Great Sage, the Bhagavat, Entered parinirvāṇa long ago, He has been abiding in a jeweled stupa; And he has now come for the sake of the Dharma. Why is it that people Do not strive for the Dharma? Although this buddha entered parinirvāṇa Incalculable kalpas ago, Because it is difficult to encounter, He listens to the Dharma Wherever it is taught. The original vow of this buddha was: After my parinirvāṇa I will always listen to the Dharma Wherever it may be. My magically created forms, Incalculable as the sands of the Ganges River, Have come to hear the Dharma And see the Tathāgata Prabhūtaratna, Who has entered nirvana. Each buddha-form, having abandoned his beautiful land, Disciples, devas, humans, nāgas, And ritual tributes, has come here So that the Dharma may abide forever. In order to seat all these buddhas, I transferred immeasurable beings And puriﬁed the lands Through my transcendent powers; And each of these buddhas Settled under a jeweled tree— As lotus blossoms Adorn a limpid, cool pond. Under every jeweled tree was a lion seat On which the buddhas sat radiating light— As a great bonﬁre Blazes in the dark of the night. They emitted a subtle fragrance from their bodies Which ﬁlled the lands of the ten directions. Sentient beings who smelled this fragrance Were overcome with unsurpassed joy, Like branches of a small tree Being blown by a great wind. Through this skillful means I enable the Dharma to abide forever. I tell the great assembly That after my nirvana Whoever can preserve and recite this sutra Should now individually make a declaration In the presence of the buddhas. Although the Buddha Prabhūtaratna"
XI,173,34a,"Entered parinirvāṇa long ago, Through his great vow He has roared the lion’s roar. The Tathāgata Prabhūtaratna, I myself, and all the magically created forms Who have gathered here Should know this intention. O heirs of the buddhas! Whoever is able to preserve the Dharma Should make a great vow So that it may abide forever. Whoever is able to preserve The teaching of this sutra Will thus honor me And Prabhūtaratna. This Buddha Prabhūtaratna Always roams the ten directions In a jeweled stupa In order to hear this sutra. He also honors All the transformed buddhas Who have come here and who adorn All the worlds with light. Whoever teaches this sutra will see me, The Tathāgata Prabhūtaratna, And the transformed buddhas. O sons of a virtuous family! Each of you must carefully consider this. This is indeed a difficult matter. Make a great vow accordingly! It is not really difficult To teach all of the other sutras, The number of which is Equal to the sands of the Ganges River. It is not difficult To take Mount Sumeru And throw it to another quarter, Over innumerable buddha worlds. It is also not difficult To shake free the manifold cosmos With one toe and throw it Far into another distant world. It is not difficult to stand On the highest summit of the world And teach the other innumerable sutras For the sake of sentient beings. However, it will indeed be difficult To teach this sutra in the troubled world After the Buddha’s nirvana. It is not difficult for anyone To grasp empty space And wander around with it. But it will certainly be difficult to copy And preserve this sutra And cause others to copy it After my nirvana. It is not really difficult To put the great earth on a toenail And ascend with it To the world of Brahmas. However, it will indeed be difficult To recite this sutra, Even for a moment, In the troubled world After the Buddha’s nirvana. It is not really difficult To enter into the conﬂagration At the time of the close of a kalpa Carrying hay on your back And yet not be burned. It certainly will be difficult To preserve this sutra And teach it to even a single person After my nirvana. It is indeed not really difficult for anyone to preserve The eighty-four thousand treasure houses of the Dharma, And the twelvefold scriptures, And teach them so that the listeners Can attain the six transcendent powers. It will indeed be difficult for anyone To hear and accept this sutra And to ask about its meaning After my nirvana. It is not really difficult for people to do Such beneﬁcial things as teaching the Dharma And making thousands of myriads of koṭis of Immeasurable, incalculable sentient beings, Numbering as many as the sands of the Ganges River, Attain arhatship and perfect The six transcendent powers. It will certainly be difficult To preserve such a sutra as this After my nirvana. I have extensively taught many sutras In incalculable lands From the beginning until now, For the sake of the buddha path; And yet among them This sutra is the best. If anyone preserves it, He preserves the form of the Buddha. O sons of a virtuous family! Those who preserve and recite this [Lotus] Sutra After my nirvana Must now individually make a declaration"
XII,176,34b,"In the presence of the buddhas. It is hard to preserve this sutra. If anyone preserves it Even for a single moment, I shall truly rejoice. All of the other buddhas Will do so also. Such people as these Are praised by the buddhas. They are courageous. They are persevering. They are known as those Who follow the rules of good conduct And carry out ascetic practices. Subsequently they quickly attain The highest buddha path. Those in the future Who recite and preserve this sutra, Are the true heirs of the Buddha And abide in the stage of purity. Those who can understand its meaning After the Buddha’s nirvana Will become the Eyes of the World For devas and humans. Those who teach it, even for a moment, In the fearful world Will be revered By all the devas and humans. Devadatta The Buddha then addressed the assembly of bodhisattvas, and also the devas, humans, and the fourfold assembly, saying: “In the past, immeasurable kalpas ago, I tirelessly sought the Lotus Sutra. Throughout many kalpas I always became a king and made a vow to seek highest enlightenment. My mind became irreversible. Wanting to fulﬁll the six perfections I diligently carried out practices: unstintingly giving elephants, horses, the seven precious treasures, countries and cities, wives and children, male and female servants, my head, eyes, marrow and brains, the ﬂesh of my body, hands, and feet, without stinginess, not even hesitating to give my own life. “At that time the lifespan of the people in the world was immeasurable. In order to seek the Dharma I abandoned my kingdom and abdicated my throne to the crown prince. Beating a drum I proclaimed to the four directions that I was seeking the Dharma, saying: I will be as a servant for the rest of my life to whosoever can teach me the Mahayana. “At that time there was a sage who came to this king and said: I possess the Mahayana teaching called the Lotus Sutra. If you faithfully obey me I will expound it to you. “Having heard the sage, the king became joyful and ecstatic and, accompanying the sage, he did everything he was asked. He gathered fruits, drew water, collected ﬁrewood, and provided meals. He even provided his own body as a bed for the sage. Yet he never tired in either body or mind and in this way served the sage for one thousand years. For the sake of the Dharma he served him diligently, making certain the sage never lacked for anything.” At that time the Bhagavat, wanting to elaborate on the meaning of this further, spoke these verses:"
XII,180,34c,"I remember that in the past, many kalpas ago, Although I became king of the world, In order to seek the great Dharma I was never attached to the desires of the ﬁve senses. Striking a bell I declared this To the four directions: If anyone possesses the great Dharma And explains it to me, I will become his servant. At that time there was a sage called Asita Who came to the great king and said: I possess a subtle and true Dharma That is rare in the world. If you are able to practice it, I will explain it to you! On hearing what the sage said The king became overjoyed. He immediately accompanied the sage And performed whatever he was asked. He gathered ﬁrewood and various fruits And respectfully offered them whenever requested. Because he longed for the True Dharma, He never tired in body or mind. For the sake of sentient beings He diligently sought everywhere the great Dharma. He never sought it for his own sake Nor for the desires of the ﬁve senses. For this reason, although a great king, He diligently sought and attained this Dharma, Ultimately becoming a buddha. That is why I now tell you this. The Buddha addressed the monks, saying: “The king at that time was I myself, and the sage was he who is now Devadatta. Through the virtuous friendship of Devadatta I was able to become endowed with the six perfections, benevolence, compassion, sympathetic joy, generosity, the thirty-two marks, the eighty excellent characteristics, reddish-gold skin, the ten powers, the four kinds of fearlessness, the four methods of gaining trust, the eighteen excellent qualities, the transcendent powers, and the power of the path. It is all due to the good and virtuous friendship of Devadatta that I attained complete enlightenment and extensively saved innumerable sentient beings.” The Buddha addressed the fourfold assembly, saying: “After immeasurable kalpas have passed, Devadatta will then become a buddha called Devarāja, a Tathāgata, Arhat, Completely Enlightened, Perfect in Knowledge and Conduct, Well-Departed, Knower of the World, Unsurpassed, Tamer of Humans, Teacher of Devas and Humans, Buddha, Bhagavat. His world will be called Devasopānā. At that time the Buddha Devarāja will abide in the world for twenty intermediate kalpas and extensively teach the True Dharma to sentient beings. Sentient beings equal in number to the sands of the Ganges River will attain arhatship. The thought of a pratyekabuddha has awakened in incalculable numbers of sentient beings. The thought of the highest path will awaken in sentient beings equal in number to the sands of the Ganges River, and they will become convinced of the nonarising of all dharmas and reside in the stage of nonretrogression. “Then, after the parinirvāṇa of the Buddha Devarāja, the True Dharma will abide in the world for twenty intermediate kalpas. A seven-jeweled stupa, sixty yojanas in height and forty yojanas in both length and width, will be built for all his relics; and all the devas and humans will honor and revere this beautiful seven-jeweled stupa with various ﬂowers, scented powders, burning incense, fragrant ointments, clothing, necklaces, banners, ﬂags, jeweled canopies, music, and songs. Incalculable sentient beings will attain arhatship. Innumerable sentient beings will be enlightened as pratyekabuddhas; and the thought of enlightenment will awaken in an inconceivable number of sentient beings, and they will reach the stage of nonretrogression.” The Buddha addressed the monks, saying: “If, in the future, there are sons and daughters of a virtuous family who, upon hearing the Devadatta chapter of the Lotus Sutra, accept it with pure minds and without doubt, they shall not fall into the realms of hell or to the states of hungry ghosts or of animals, but will be born in the presence of the buddhas in the ten directions. Wherever"
XII,182,35b,"they may be, they will always hear this sutra. If they are born among humans or devas, they will enjoy a supreme and delightful contentment; and if in the presence of a buddha, they will be born spontaneously in a lotus ﬂower.” At that time, in the lower region there was a bodhisattva called Prajñākūṭa who was accompanying the Bhagavat Prabhūtaratna. He urged the Buddha Prabhūtaratna to return to their original land. The Buddha Śākyamuni addressed Prajñākūṭa, saying: “O son of a virtuous family! Wait for a moment! There is a bodhisattva called Mañjuśrī. Let us meet him together and discuss the True Dharma. After that you can return to your original land.” At that time Mañjuśrī, sitting on a thousand-petaled lotus ﬂower as large as a carriage wheel, together with attendant bodhisattvas also seated on jeweled lotus ﬂowers, emerged spontaneously out of the ocean from the palace of the nāga king Sāgara and ﬂoated in midair. Arriving at Mount Gṛdhrakūṭa they descended from the lotus ﬂowers and went into the presence of the buddhas, where they bowed until their foreheads touched the feet of both Bhagavats. Having honored them, Mañjuśrī approached Prajñākūṭa. They greeted each other and withdrew to sit at one side. Then Bodhisattva Prajñākūṭa asked Mañjuśrī, saying: “Your Eminence! How many sentient beings did you lead and inspire at the palace of the nāga king?” Mañjuśrī answered: “The number is immeasurable and incalculable. It is not possible to express it in words nor is it possible to calculate it with one’s mind. Wait a moment and you will have proof!” Before he had ﬁnished speaking, innumerable bodhisattvas emerged from the ocean, seated on jeweled lotus ﬂowers. Arriving at Mount Gṛdhrakūṭa they ﬂoated in midair. All of these were bodhisattvas who had been led and inspired by Mañjuśrī. Those who had perfected the bodhisattva practices discussed the six perfections together. Those who were originally śrāvakas explained the śrāvaka practices in the air; and now they all practice to understand the meaning of emptiness of the Mahayana. Mañjuśrī said to Prajñākūṭa: “Thus did I lead and inspire people in the ocean!” Thereupon Bodhisattva Prajñākūṭa spoke these verses in praise: O One of great wisdom, virtue, and courage! This assembly and I have now all witnessed that You have led and inspired Incalculable numbers of sentient beings. You have expounded the essential character of dharmas And revealed the teaching of the single vehicle. You have extensively led many sentient beings, Causing them to quickly attain enlightenment. Mañjuśrī said: “In the ocean I always expounded only the Lotus Sutra.” Then Prajñākūṭa questioned Mañjuśrī, saying: “This sutra is profound and subtle. It is a jewel among sutras and rare in the world. If sentient beings diligently strive to practice this sutra, will they immediately become buddhas or not?” Mañjuśrī answered: “Yes, they will. There is the daughter of the nāga king Sāgara who is only eight years old. She is wise; her faculties are sharp; and she also well knows all the faculties and deeds of sentient beings. She has attained the power of recollection. She preserves all the profound secret treasures taught by the buddhas, enters deep meditation, and is well capable of discerning all dharmas. She instantly produced the thought of enlightenment and attained the stage of nonretrogression. She has unhindered eloquence and thinks of sentient beings with as much compassion as if they were her own children. Her virtues are perfect. Her thoughts and explanations are subtle and extensive, merciful, and compassionate. She has a harmonious mind and has attained enlightenment.” The Bodhisattva Prajñākūṭa said: “I see the Tathāgata Śākyamuni who has been incessantly carrying out difficult and severe practices for immeasurable kalpas, accumulating merit and virtue while seeking the bodhisattva path. Looking into the great manifold cosmos, there is not a single place even the size of a mustard seed where this bodhisattva has not abandoned his life for the sake of sentient beings. He attained the path to enlightenment only after this. It is hard to believe that this girl will instantly attain complete enlightenment.” Before he had ﬁnished speaking the daughter of the nāga king suddenly appeared in their presence. Bowing until her forehead touched their feet, she withdrew to one side and spoke these verses in praise: The Buddha is deeply versed In the characteristics of good and evil, And he completely illuminates the ten directions. His subtle and pure Dharma body Is endowed with the thirty-two marks; With the eighty good characteristics Is his Dharma body adorned. He is adored by devas and humans, And honored by nāgas. There is no sentient being Who does not pay him homage. Moreover, that I will attain enlightenment Upon hearing him Can only be known by a buddha. I will reveal the teaching of the Mahayana And save suffering sentient beings."
