Chapter,Section,VerseRange,Text
3,9,12-14,"Sakalya said: `Whosoever knows that person whose dwelling are the colours, whose sight is the eye, whose mind is light, the principle of every self, he indeed is a teacher, O Yagnavalkya.' Yagnavalkya replied: `I know that person, the principle of every self, of whom thou speakest. That person in the sun, ""he is he."" But tell me, Sakalya, who is his devata?' Sakalya replied: `The True.' Sakalya said: `Whosoever knows that person whose dwelling is ether, whose sight is the ear, whose mind is light, the principle of every self, he indeed is a teacher, O Yagnavalkya.' Yagnavalkya replied: `I know that person, the principle of every self, of whom thou speakest. The person who hears and answers, ""he is he."" But tell me, Sakalya, who is his devata?' Sakalya replied: `Space.' Sakalya said: `Whosoever knows that person"
3,9,13-15,"Sakalya said: `Whosoever knows that person whose dwelling is ether, whose sight is the ear, whose mind is light, the principle of every self, he indeed is a teacher, O Yagnavalkya.' Yagnavalkya replied: `I know that person, the principle of every self, of whom thou speakest. The person who hears and answers, ""he is he."" But tell me, Sakalya, who is his devata?' Sakalya replied: `Space.' Sakalya said: `Whosoever knows that person whose dwelling is darkness, whose sight is the heart, whose mind is light, the principle of every self, he indeed is a teacher, O Yagnavalkya.' Yagnavalkya replied: `I know that person, the principle of every self, of whom thou speakest. The shadowy person, ""he is he."" But tell me, Sakalya, who is his devata?' Sakalya replied: `Death.' Sakalya said: `Whosoever knows that person"
3,9,14-16,"Sakalya said: `Whosoever knows that person whose dwelling is darkness, whose sight is the heart, whose mind is light, the principle of every self, he indeed is a teacher, O Yagnavalkya.' Yagnavalkya replied: `I know that person, the principle of every self, of whom thou speakest. The shadowy person, ""he is he."" But tell me, Sakalya, who is his devata?' Sakalya replied: `Death.' Sakalya said: `Whosoever knows that person whose dwelling are (bright) colours, whose sight is the eye, whose mind is light, the principle of every self, he indeed is a teacher, O Yagnavalkya.' Yagnavalkya replied: `I know that person, the principle of every self, of whom thou speakest. The person in the looking-glass, ""he is he."" But tell me, Sakalya, who is his devata?' Sakalya replied: `Vital breath'(asu). Sakalya said: `Whosoever knows that person"
3,9,15-17,"Sakalya said: `Whosoever knows that person whose dwelling are (bright) colours, whose sight is the eye, whose mind is light, the principle of every self, he indeed is a teacher, O Yagnavalkya.' Yagnavalkya replied: `I know that person, the principle of every self, of whom thou speakest. The person in the looking-glass, ""he is he."" But tell me, Sakalya, who is his devata?' Sakalya replied: `Vital breath'(asu). Sakalya said: `Whosoever knows that person whose dwelling is water, whose sight is the heart, whose mind is light, the principle of every self, he indeed is a teacher, O Yagnavalkya.' Yagnavalkya replied: `I know that person, the principle of every self, of whom thou speakest. The person in the water, ""he is he."" But tell me, Sakalya, who is his devata?' Sakalya replied: `Varuna.' Sakalya said: `Whosoever knows that person"
3,9,16-18,"Sakalya said: `Whosoever knows that person whose dwelling is water, whose sight is the heart, whose mind is light, the principle of every self, he indeed is a teacher, O Yagnavalkya.' Yagnavalkya replied: `I know that person, the principle of every self, of whom thou speakest. The person in the water, ""he is he."" But tell me, Sakalya, who is his devata?' Sakalya replied: `Varuna.' Sakalya said: `Whosoever knows that person whose dwelling is seed, whose sight is the heart, whose mind is light, the principle of every self, he indeed is a teacher, O Yagnavalkya.' Yagnavalkya replied: `I know that person, the principle of every self, of whom thou speakest. The filial person, ""he is he."" But tell me, Sakalya, who is his devata?' Sakalya replied: `Pragapati.' Yagnavalkya said: `Sakalya, did those"
3,9,17-19,"Sakalya said: `Whosoever knows that person whose dwelling is seed, whose sight is the heart, whose mind is light, the principle of every self, he indeed is a teacher, O Yagnavalkya.' Yagnavalkya replied: `I know that person, the principle of every self, of whom thou speakest. The filial person, ""he is he."" But tell me, Sakalya, who is his devata?' Sakalya replied: `Pragapati.' Yagnavalkya said: `Sakalya, did those make thee the victim?' Sakalya said: `Yagnavalkya, because thou hast decried Brahman dost thou know?' Yagnavalkya said: `I know the quarters with their"
3,9,18-20,"Yagnavalkya said: `Sakalya, did those make thee the victim?' Sakalya said: `Yagnavalkya, because thou hast decried Brahman dost thou know?' Yagnavalkya said: `I know the quarters with their deities and their abodes.' Sakalya said: `If thou knowest the quarters with their deities and their abodes, `Which is thy deity in the Eastern quarter?'"
3,9,19-21,"Yagnavalkya said: `I know the quarters with their deities and their abodes.' Sakalya said: `If thou knowest the quarters with their deities and their abodes, `Which is thy deity in the Eastern quarter?' Yagnavalkya said: `Aditya (the sun).' Sakalya said: `In what does that Aditya abide?' Yagnavalkya said: `In the eye.' Sakalya said: `In what does the eye abide?' Yagnavalkya said: `In the colours, for with the eye he sees the colours.' Sakalya said: `And in what then do the colours abide?' Yagnavalkya said: `In the heart, for we know colours by the heart, for colours abide in the heart.' Sakalya said: `So it is indeed, O Yagnavalkya.' Sakalya said: `Which is thy deity in the Southern"
3,9,20-22,"`Which is thy deity in the Eastern quarter?' Yagnavalkya said: `Aditya (the sun).' Sakalya said: `In what does that Aditya abide?' Yagnavalkya said: `In the eye.' Sakalya said: `In what does the eye abide?' Yagnavalkya said: `In the colours, for with the eye he sees the colours.' Sakalya said: `And in what then do the colours abide?' Yagnavalkya said: `In the heart, for we know colours by the heart, for colours abide in the heart.' Sakalya said: `So it is indeed, O Yagnavalkya.' Sakalya said: `Which is thy deity in the Southern quarter?' Yagnavalkya said: `Yama.' Sakalya said: `In what does that Yama abide?' Yagnavalkya said: `In the sacrifice.' Sakalya said: `In what does the sacrifice abide?' Yagnavalkya said: `In the Dakshina. (the gifts to be given to the priests).' Sakalya said: `In what does the Dakshina abide?' Yagnavalkya said: `In Sraddha (faith), for if a man believes, then he gives Dakshina, and Dakshina truly abides in faith.' Sakalya said: `And in what then does faith abide?' Yagnavalkya said: `In the heart, for by the heart faith knows, and therefore faith abides in the heart.' Sakalya said: `So it is indeed, O Yagnavalkya.' Sakalya said: `Which is thy deity in the Western"
3,9,21-23,"Sakalya said: `Which is thy deity in the Southern quarter?' Yagnavalkya said: `Yama.' Sakalya said: `In what does that Yama abide?' Yagnavalkya said: `In the sacrifice.' Sakalya said: `In what does the sacrifice abide?' Yagnavalkya said: `In the Dakshina. (the gifts to be given to the priests).' Sakalya said: `In what does the Dakshina abide?' Yagnavalkya said: `In Sraddha (faith), for if a man believes, then he gives Dakshina, and Dakshina truly abides in faith.' Sakalya said: `And in what then does faith abide?' Yagnavalkya said: `In the heart, for by the heart faith knows, and therefore faith abides in the heart.' Sakalya said: `So it is indeed, O Yagnavalkya.' Sakalya said: `Which is thy deity in the Western quarter?' Yagnavalkya said: `Varuna.' Sakalya said: `In what does that Varuna abide?' Yagnavalkya said: `In the water.' Sakalya said: `In what does the water abide?' Yagnavalkya said: `In the seed.' Sakalya said: `And in what does the seed abide?' Yagnavalkya said: `In the heart. And therefore also they say of a son who is like his father, that he seems as if slipt from his heart, or made from his heart; for the seed abides in the heart.' Sakalya said: `So it is indeed, O Yagnavalkya.' Sakalya said: `Which is thy deity in the Northern"
3,9,22-24,"Sakalya said: `Which is thy deity in the Western quarter?' Yagnavalkya said: `Varuna.' Sakalya said: `In what does that Varuna abide?' Yagnavalkya said: `In the water.' Sakalya said: `In what does the water abide?' Yagnavalkya said: `In the seed.' Sakalya said: `And in what does the seed abide?' Yagnavalkya said: `In the heart. And therefore also they say of a son who is like his father, that he seems as if slipt from his heart, or made from his heart; for the seed abides in the heart.' Sakalya said: `So it is indeed, O Yagnavalkya.' Sakalya said: `Which is thy deity in the Northern quarter?' Yagnavalkya said: `Soma.' Sakalya said: `In what does that Soma abide?' Yagnavalkya said: `In the Diksha.' Sakalya said: `In what does the Diksha abide?' Yagnavalkya said: `In the True; and therefore they say to one who has performed the Diksha, Speak what is true, for in the True indeed the Diksha abides.' Sakalya said: `And in what does the True abide?' Yagnavalkya said: `In the heart, for with the heart do we know what is true, and in the heart indeed the True abides.' Sakalya said: `So it is indeed, O Yagnavalkya.' Sakalya said: `Which is thy deity in the zenith?'"
3,9,23-25,"Sakalya said: `Which is thy deity in the Northern quarter?' Yagnavalkya said: `Soma.' Sakalya said: `In what does that Soma abide?' Yagnavalkya said: `In the Diksha.' Sakalya said: `In what does the Diksha abide?' Yagnavalkya said: `In the True; and therefore they say to one who has performed the Diksha, Speak what is true, for in the True indeed the Diksha abides.' Sakalya said: `And in what does the True abide?' Yagnavalkya said: `In the heart, for with the heart do we know what is true, and in the heart indeed the True abides.' Sakalya said: `So it is indeed, O Yagnavalkya.' Sakalya said: `Which is thy deity in the zenith?' Yagnavalkya said: `Agni.' Sakalya said: `In what does that Agni abide.' Yagnavalkya said: `In speech.' Sakalya said: `And in what does speech abide?' Yagnavalkya said: `In the heart.' Sakalya said: `And in what does the heart abide?' Yagnavalkya said: `O Ahallika, when you think"
3,9,24-26,"Sakalya said: `Which is thy deity in the zenith?' Yagnavalkya said: `Agni.' Sakalya said: `In what does that Agni abide.' Yagnavalkya said: `In speech.' Sakalya said: `And in what does speech abide?' Yagnavalkya said: `In the heart.' Sakalya said: `And in what does the heart abide?' Yagnavalkya said: `O Ahallika, when you think the heart could be anywhere else away from us, if it were away from us, the dogs might eat it, or the birds tear it.' Sakalya said: `And in what dost thou (thy body)"
3,9,25-28,"Yagnavalkya said: `O Ahallika, when you think the heart could be anywhere else away from us, if it were away from us, the dogs might eat it, or the birds tear it.' Sakalya said: `And in what dost thou (thy body) and the Self (thy heart) abide?' Yagnavalkya said: `In the Prana (breath).' Sakalya said: `In what does the Prana abide?' Yagnavalkya said: `In the Apana (down-breathing).' Sakalya said: `In what does the Apana abide?' Yagnavalkya said: `In the Vyana (back-breathing).' Sakalya said: `In what does the Vyana abide?' Yagnavalkya said: `In the Udana (the out-breathing).' Sakalya said: `In what does the Udana abide?' Yagnavalkya said: `In the Samana. That Self (atman) is to be described by No, no! He is incomprehensible, for he cannot be (is not) comprehended; he is imperishable, for he cannot perish; he is unattached, for he does not attach himself; unfettered, he does not suffer, he does not fail.' `These are the eight abodes (the earth, &c.), the eight worlds (fire, &c.), the eight gods (the immortal food, &c.), the eight persons (the corporeal, &c.) He who after dividing and uniting these persons, went beyond (the Samana), that person, taught in the Upanishads, I now ask thee (to teach me). If thou shalt not explain him to me, thy head will fall.' Sakalya did not know him, and his head fell, nay, thieves took away his bones, mistaking them for something else. whosoever among you desires to do so, may now question me. Or question me, all of you. Or whosoever among you desires it, I shall question him, or I shall question all of you. Then Yagnavalkya questioned them with these"
3,9,27-28,"Sakalya said: `And in what dost thou (thy body) and the Self (thy heart) abide?' Yagnavalkya said: `In the Prana (breath).' Sakalya said: `In what does the Prana abide?' Yagnavalkya said: `In the Apana (down-breathing).' Sakalya said: `In what does the Apana abide?' Yagnavalkya said: `In the Vyana (back-breathing).' Sakalya said: `In what does the Vyana abide?' Yagnavalkya said: `In the Udana (the out-breathing).' Sakalya said: `In what does the Udana abide?' Yagnavalkya said: `In the Samana. That Self (atman) is to be described by No, no! He is incomprehensible, for he cannot be (is not) comprehended; he is imperishable, for he cannot perish; he is unattached, for he does not attach himself; unfettered, he does not suffer, he does not fail.' `These are the eight abodes (the earth, &c.), the eight worlds (fire, &c.), the eight gods (the immortal food, &c.), the eight persons (the corporeal, &c.) He who after dividing and uniting these persons, went beyond (the Samana), that person, taught in the Upanishads, I now ask thee (to teach me). If thou shalt not explain him to me, thy head will fall.' Sakalya did not know him, and his head fell, nay, thieves took away his bones, mistaking them for something else. whosoever among you desires to do so, may now question me. Or question me, all of you. Or whosoever among you desires it, I shall question him, or I shall question all of you. Then Yagnavalkya questioned them with these Slokas: 1. `As a mighty tree in the forest, so in truth is man, his hairs are the leaves, his outer skin is the bark. 2. `From his skin flows forth blood, sap from the skin (of the tree); and thus from the wounded man comes forth blood, as from a tree that is struck. 3. `The lumps of his flesh are (in the tree) the layers of wood, the fibre is strong like the tendons. The bones are the (hard) wood within, the marrow is made like the marrow of the tree. 4. `But, while the tree, when felled, grows up again more young from the root, from what root, tell me, does a mortal grow up, after he has been felled by death? 5. `Do not say, ""from seed,"" for seed is produced from the living; but a tree, springing from a grain, clearly rises again after death. 6. `If a tree is pulled up with the root, it will not grow again; from what root then, tell me, does a mortal grow up, after he has been felled by death? 7. `Once born, he is not born (again); for who should create him again?' `Brahman, who is knowledge and bliss, he is the principle, both to him who gives gifts, and also to him who stands firm, and knows.' "
4,1,1-3,"When Ganaka Vaideha was sitting (to give audience), Yagnavalkya approached, and Ganaka Vaideha said: `Yagnavalkya, for what object did you come, wishing for cattle, or for subtle questions?' Yagnavalkya replied: `For both, Your Majesty; `Let us hear what anybody may have told you.' Ganaka Vaideha replied: `Gitvan Sailini told me that speech (vak) is Brahman.' Yagnavalkya said: `As one who had (the benefit of a good) father, mother, and teacher might tell, so did Sailini tell you, that speech is Brahman; for what is the use of a dumb person? But did he tell you the body (ayatana) and the resting-place (pratishtha) of that Brahman?' Ganaka Vaideha said: `He did not tell me.' Yagnavalkya said: `Your Majesty, this (Brahman) stands on one leg only.' Ganaka Vaideha said: `Then tell me, Yagnavalkya.' Yagnavalkya said: `The tongue is its body, ether its place, and one should worship it as knowledge.' Ganaka Vaideha said: `What is the nature of that knowledge?' Yagnavalkya replied: `Your Majesty, speech itself (is knowledge). For through speech, Your Majesty, a friend is known (to be a friend), and likewise the Rigveda, Yagur-veda, Sama-veda, the Atharvangirasas, the Itihasa (tradition), Purana-vidya (knowledge of the past), the Upanishads, Slokas (verses), Sutras (rules), Anuvyakhyanas and Vyakhyanas (commentaries, &c.); what is sacrificed, what is poured out, what is (to be) eaten and drunk, this world and the other world, and all creatures. By speech alone, Your Majesty, Brahman is known, speech indeed, O King, is the Highest Brahman. Speech does not desert him who worships that (Brahman) with such knowledge, all creatures approach him, and having become a god, he goes to the gods.' Ganaka Vaideha said: `I shall give you (for this) a thousand cows with a bull as big as an elephant.' Yagnavalkya said: `My father was of opinion that one should not accept a reward without having fully instructed a pupil.' Yagnavalkya said: `Let us hear what anybody may"
4,1,2-4,"`Let us hear what anybody may have told you.' Ganaka Vaideha replied: `Gitvan Sailini told me that speech (vak) is Brahman.' Yagnavalkya said: `As one who had (the benefit of a good) father, mother, and teacher might tell, so did Sailini tell you, that speech is Brahman; for what is the use of a dumb person? But did he tell you the body (ayatana) and the resting-place (pratishtha) of that Brahman?' Ganaka Vaideha said: `He did not tell me.' Yagnavalkya said: `Your Majesty, this (Brahman) stands on one leg only.' Ganaka Vaideha said: `Then tell me, Yagnavalkya.' Yagnavalkya said: `The tongue is its body, ether its place, and one should worship it as knowledge.' Ganaka Vaideha said: `What is the nature of that knowledge?' Yagnavalkya replied: `Your Majesty, speech itself (is knowledge). For through speech, Your Majesty, a friend is known (to be a friend), and likewise the Rigveda, Yagur-veda, Sama-veda, the Atharvangirasas, the Itihasa (tradition), Purana-vidya (knowledge of the past), the Upanishads, Slokas (verses), Sutras (rules), Anuvyakhyanas and Vyakhyanas (commentaries, &c.); what is sacrificed, what is poured out, what is (to be) eaten and drunk, this world and the other world, and all creatures. By speech alone, Your Majesty, Brahman is known, speech indeed, O King, is the Highest Brahman. Speech does not desert him who worships that (Brahman) with such knowledge, all creatures approach him, and having become a god, he goes to the gods.' Ganaka Vaideha said: `I shall give you (for this) a thousand cows with a bull as big as an elephant.' Yagnavalkya said: `My father was of opinion that one should not accept a reward without having fully instructed a pupil.' Yagnavalkya said: `Let us hear what anybody may have told you.' Ganaka Vaideha replied: `Udanka Saulbayana told me that life (prana) is Brahman.' Yagnavalkya said: `As one who had (the benefit of a good) father, mother, and teacher might tell, so did Udanka Saulbayana tell you that life is Brahman; for what is the use of a person without life? But did he tell you the body and the resting-place of that Brahman?' Ganaka Vaideha said: `He did not tell me.' Yagnavalkya said: `Your Majesty, this (Brahman) stands on one leg only.' Ganaka Vaideha said: `Then tell me, Yagnavalkya.' Yagnavalkya said: `Breath is its body, ether its place, and one should worship it as what is dear.' Ganaka Vaideha said: `What is the nature of that which is dear?' Yagnavalkya replied: `Your Majesty, life itself (is that which is dear);' because for the sake of life, Your Majesty, a man sacrifices even for him who is unworthy of sacrifice, he accepts presents from him who is not worthy to bestow presents, nay, he goes to a country, even when there is fear of being hurt, for the sake of life. Life, O King, is the Highest Brahman. Life does not desert him who worships that (Brahman) with such knowledge, all creatures approach him, and having become a god, he goes to the gods.' Ganaka Vaideha said: `I shall give you (for this) a thousand cows with a bull as big as an elephant.' Yagnavalkya said: `My father was of opinion that one should not accept a reward without having fully instructed a pupil.' Yagnavalkya said: `Let us hear what anybody may"
4,1,3-5,"Yagnavalkya said: `Let us hear what anybody may have told you.' Ganaka Vaideha replied: `Udanka Saulbayana told me that life (prana) is Brahman.' Yagnavalkya said: `As one who had (the benefit of a good) father, mother, and teacher might tell, so did Udanka Saulbayana tell you that life is Brahman; for what is the use of a person without life? But did he tell you the body and the resting-place of that Brahman?' Ganaka Vaideha said: `He did not tell me.' Yagnavalkya said: `Your Majesty, this (Brahman) stands on one leg only.' Ganaka Vaideha said: `Then tell me, Yagnavalkya.' Yagnavalkya said: `Breath is its body, ether its place, and one should worship it as what is dear.' Ganaka Vaideha said: `What is the nature of that which is dear?' Yagnavalkya replied: `Your Majesty, life itself (is that which is dear);' because for the sake of life, Your Majesty, a man sacrifices even for him who is unworthy of sacrifice, he accepts presents from him who is not worthy to bestow presents, nay, he goes to a country, even when there is fear of being hurt, for the sake of life. Life, O King, is the Highest Brahman. Life does not desert him who worships that (Brahman) with such knowledge, all creatures approach him, and having become a god, he goes to the gods.' Ganaka Vaideha said: `I shall give you (for this) a thousand cows with a bull as big as an elephant.' Yagnavalkya said: `My father was of opinion that one should not accept a reward without having fully instructed a pupil.' Yagnavalkya said: `Let us hear what anybody may have told you.' Ganaka Vaideha replied: `Barku Varshna told me that sight (kakshus) is Brahman.' Yagnavalkya said: `As one who had (the benefit of a good) father, mother, and teacher might tell, so did Barku Varshna tell you that sight is Brahman; for what is the use of a person who cannot see? But did he tell you the body and the resting-place of that Brahman?' Ganaka Vaideha said: `He did not tell me.' Yagnavalkya said: `Your Majesty, this (Brahman) stands on one leg only.' Ganaka Vaideha said: `Then tell me, Yagnavalkya.' Yagnavalkya said: `The eye is its body, ether its place, and one should worship it as what is true.' Ganaka Vaideha said: `What is the nature of that which is true?' Yagnavalkya replied: `Your Majesty, sight itself (is that which is true); for if they say to a man who sees with his eye, ""Didst thou see?"" and he says, ""I saw,"" then it is true. Sight, O King, is the Highest Brahman. Sight does not desert him who worships that (Brahman) with such knowledge, all creatures approach him, and having become a god, he goes to the gods.' Ganaka Vaideha said: `I shall give you (for this) a thousand cows with a bull as big as an elephant.' Yagnavalkya said: `My father was of opinion that one should not accept a reward without having fully instructed a pupil.' Yagnavalkya said: `Let us hear what anybody may"
