Chapter,Section,VerseRange,Text
2,2,1-3,"Verily he who knows the babe with his place, his chamber, his post, and his rope, he keeps off the seven relatives who hate him. Verily by the young is meant the inner life, by his place this (body), by his chamber this (head), by his post the vital breath, by his rope the food. Then the seven imperishable ones approach him. There are the red lines in the eye, and by them Rudra clings to him. There is the water in the eye, and by it Parganya clings to him. There is the pupil, and by it Aditya (sun) clings to him. There is the dark iris, and by it Agni clings to him. There is the white eye-ball, and by it Indra clings to him. With the lower eye-lash the earth, with the upper eye-lash the heaven clings to him. He who knows this, his food does never perish. On this there is this Sloka:"
2,2,2-4,"Then the seven imperishable ones approach him. There are the red lines in the eye, and by them Rudra clings to him. There is the water in the eye, and by it Parganya clings to him. There is the pupil, and by it Aditya (sun) clings to him. There is the dark iris, and by it Agni clings to him. There is the white eye-ball, and by it Indra clings to him. With the lower eye-lash the earth, with the upper eye-lash the heaven clings to him. He who knows this, his food does never perish. On this there is this Sloka: `There is a cup having its mouth below and its bottom above. Manifold glory has been placed into it. On its lip sit the seven Rishis, the tongue as the eighth communicates with Brahman.' What is called the cup having its mouth below and its bottom above is this head, for its mouth (the mouth) is below, its bottom (the skull) is above. When it is said that manifold glory has been placed into it, the senses verily are manifold glory, and he therefore means the senses. When he says that the seven Rishis sit on its lip, the Rishis are verily the (active) senses, and he means the senses. And when he says that the tongue as the eighth communicates with Brahman, it is because the tongue, as the eighth, does communicate with Brahman. These two (the two ears) are the Rishis Gautama"
2,2,3-4,"On this there is this Sloka: `There is a cup having its mouth below and its bottom above. Manifold glory has been placed into it. On its lip sit the seven Rishis, the tongue as the eighth communicates with Brahman.' What is called the cup having its mouth below and its bottom above is this head, for its mouth (the mouth) is below, its bottom (the skull) is above. When it is said that manifold glory has been placed into it, the senses verily are manifold glory, and he therefore means the senses. When he says that the seven Rishis sit on its lip, the Rishis are verily the (active) senses, and he means the senses. And when he says that the tongue as the eighth communicates with Brahman, it is because the tongue, as the eighth, does communicate with Brahman. These two (the two ears) are the Rishis Gautama and Bharadvaga; the right Gautama, the left Bharadvaga. These two (the eyes) are the Rishis Visvamitra and Gamadagni; the right Visvamitra, the left Gamadagni. These two (the nostrils) are the Rishis Vasishtha and Kasyapa; the right Vasishtha, the left Kasyapa. The tongue is Atri, for with the tongue food is eaten, and Atri is meant for Atti, eating. He who knows this, becomes an eater of everything, and everything becomes his food."
2,3,1-3,"There are two forms of Brahman, the material and the immaterial, the mortal and the immortal, the solid and the fluid, sat (being) and tya (that), (i.e. sattya, true). Everything except air and sky is material, is mortal, is solid, is definite. The essence of that which is material, which is mortal, which is solid, which is definite is the sun that shines, for he is the essence of sat (the definite). But air and sky are immaterial, are immortal, are"
2,3,2-4,"Everything except air and sky is material, is mortal, is solid, is definite. The essence of that which is material, which is mortal, which is solid, which is definite is the sun that shines, for he is the essence of sat (the definite). But air and sky are immaterial, are immortal, are fluid, are indefinite. The essence of that which is immaterial, which is immortal, which is fluid, which is indefinite is the person in the disk of the sun, for he is the essence of tyad (the indefinite). So far with regard to the Devas. Now with regard to the body. Everything except"
2,3,3-5,"But air and sky are immaterial, are immortal, are fluid, are indefinite. The essence of that which is immaterial, which is immortal, which is fluid, which is indefinite is the person in the disk of the sun, for he is the essence of tyad (the indefinite). So far with regard to the Devas. Now with regard to the body. Everything except the breath and the ether within the body is material, is mortal, is solid, is definite. The essence of that which is material, which is mortal, which is solid, which is definite is the Eye, for it is the essence of sat (the definite). But breath and the ether within the body are"
2,3,4-6,"Now with regard to the body. Everything except the breath and the ether within the body is material, is mortal, is solid, is definite. The essence of that which is material, which is mortal, which is solid, which is definite is the Eye, for it is the essence of sat (the definite). But breath and the ether within the body are immaterial, are immortal, are fluid, are indefinite. The essence of that which is immaterial, which is immortal, which is fluid, which is indefinite is the person in the right eye, for he is the essence of tyad (the indefinite). And what is the appearance of that person? Like"
2,3,5-6,"But breath and the ether within the body are immaterial, are immortal, are fluid, are indefinite. The essence of that which is immaterial, which is immortal, which is fluid, which is indefinite is the person in the right eye, for he is the essence of tyad (the indefinite). And what is the appearance of that person? Like a saffron-coloured raiment, like white wool, like cochineal, like the flame of fire, like the white lotus, like sudden lightning. He who knows this, his glory is like unto sudden lightning. Next follows the teaching (of Brahman) by No, no! for there is nothing else higher than this (if one says): `It is not so.' Then comes the name `the True of the True,' the senses being the True, and he (the Brahman) the True of them."
2,4,1-3,"Now when Yagnavalkya was going to enter upon another state, he said: `Maitreyi, verily I am going away from this my house (into the forest). Forsooth, let me make a settlement between thee and that Katyayani (my other wife).' Maitreyi said: `My Lord, if this whole earth, full of wealth, belonged to me, tell me, should I be immortal by it?' `No,' replied Yagnavalkya; `like the life of rich people will be thy life. But there is no hope of immortality by wealth.' And Maitreyi said: `What should I do with that by"
2,4,2-4,"Maitreyi said: `My Lord, if this whole earth, full of wealth, belonged to me, tell me, should I be immortal by it?' `No,' replied Yagnavalkya; `like the life of rich people will be thy life. But there is no hope of immortality by wealth.' And Maitreyi said: `What should I do with that by which I do not become immortal? What my Lord knoweth (of immortality), tell that to me'. Yagnavalkya replied: `Thou who art truly dear to"
2,4,3-5,"And Maitreyi said: `What should I do with that by which I do not become immortal? What my Lord knoweth (of immortality), tell that to me'. Yagnavalkya replied: `Thou who art truly dear to me, thou speakest dear words. Come, sit down, I will explain it to thee, and mark well what I say.' And he said: `Verily, a husband is not dear, that"
2,4,4-6,"Yagnavalkya replied: `Thou who art truly dear to me, thou speakest dear words. Come, sit down, I will explain it to thee, and mark well what I say.' And he said: `Verily, a husband is not dear, that you may love the husband; but that you may love the Self, therefore a husband is dear. `Verily, a wife is not dear, that you may love the wife; but that you may love the Self, therefore a wife is dear. `Verily, sons are not dear, that you may love the sons; but that you may love the Self, therefore sons are dear. `Verily, wealth is not dear, that you may love wealth; but that you may love the Self, therefore wealth is dear. `Verily, the Brahman-class is not dear, that you may love the Brahman-class; but that you may love the Self, therefore the Brahman-class is dear. `Verily, the Kshatra-class is not dear, that you may love the Kshatra-class; but that you may love the Self, therefore the Kshatra-class is dear. `Verily, the worlds are not dear, that you may love the worlds; but that you may love the Self, therefore the worlds are dear. `Verily, the Devas are not dear, that you may love the Devas; but that you may love the Self, therefore the Devas are dear. `Verily, creatures are not dear, that you may love the creatures; but that you may love the Self, therefore are creatures dear. `Verily, everything is not dear that you may love everything; but that you may love the Self, therefore everything is dear. `Verily, the Self is to be seen, to be heard, to be perceived, to be marked, O Maitreyi! When we see, hear, perceive, and know the Self, then all this is known. `Whosoever looks for the Brahman-class"
2,4,5-7,"And he said: `Verily, a husband is not dear, that you may love the husband; but that you may love the Self, therefore a husband is dear. `Verily, a wife is not dear, that you may love the wife; but that you may love the Self, therefore a wife is dear. `Verily, sons are not dear, that you may love the sons; but that you may love the Self, therefore sons are dear. `Verily, wealth is not dear, that you may love wealth; but that you may love the Self, therefore wealth is dear. `Verily, the Brahman-class is not dear, that you may love the Brahman-class; but that you may love the Self, therefore the Brahman-class is dear. `Verily, the Kshatra-class is not dear, that you may love the Kshatra-class; but that you may love the Self, therefore the Kshatra-class is dear. `Verily, the worlds are not dear, that you may love the worlds; but that you may love the Self, therefore the worlds are dear. `Verily, the Devas are not dear, that you may love the Devas; but that you may love the Self, therefore the Devas are dear. `Verily, creatures are not dear, that you may love the creatures; but that you may love the Self, therefore are creatures dear. `Verily, everything is not dear that you may love everything; but that you may love the Self, therefore everything is dear. `Verily, the Self is to be seen, to be heard, to be perceived, to be marked, O Maitreyi! When we see, hear, perceive, and know the Self, then all this is known. `Whosoever looks for the Brahman-class elsewhere than in the Self, was abandoned by the Brahman-class. Whosoever looks for the Kshatra-class elsewhere than in the Self, was abandoned by the Kshatra-class. Whosoever looks for the worlds elsewhere than in the Self, was abandoned by the worlds. Whosoever looks for the Devas elsewhere than in the Self, was abandoned by the Devas. Whosoever looks for creatures elsewhere than in the Self, was abandoned by the creatures. Whosoever looks for anything elsewhere than in the Self, was abandoned by everything. This Brahman-class, this Kshatra-class, these worlds, these Devas, these creatures, this everything, all is that Self. `Now as the sounds of a drum, when beaten,"
2,4,6-8,"`Whosoever looks for the Brahman-class elsewhere than in the Self, was abandoned by the Brahman-class. Whosoever looks for the Kshatra-class elsewhere than in the Self, was abandoned by the Kshatra-class. Whosoever looks for the worlds elsewhere than in the Self, was abandoned by the worlds. Whosoever looks for the Devas elsewhere than in the Self, was abandoned by the Devas. Whosoever looks for creatures elsewhere than in the Self, was abandoned by the creatures. Whosoever looks for anything elsewhere than in the Self, was abandoned by everything. This Brahman-class, this Kshatra-class, these worlds, these Devas, these creatures, this everything, all is that Self. `Now as the sounds of a drum, when beaten, cannot be seized externally (by themselves), but the sound is seized, when the drum is seized or the beater of the drum; `And as the sounds of a conch-shell, when blown,"
2,4,7-9,"`Now as the sounds of a drum, when beaten, cannot be seized externally (by themselves), but the sound is seized, when the drum is seized or the beater of the drum; `And as the sounds of a conch-shell, when blown, cannot be seized externally (by themselves), but the sound is seized, when the shell is seized or the blower of the shell; `And as the sounds of a lute, when played, cannot"
2,4,8-10,"`And as the sounds of a conch-shell, when blown, cannot be seized externally (by themselves), but the sound is seized, when the shell is seized or the blower of the shell; `And as the sounds of a lute, when played, cannot be seized externally (by themselves), but the sound is seized, when the lute is seized or the player of the lute; `As clouds of smoke proceed by themselves out"
2,4,9-11,"`And as the sounds of a lute, when played, cannot be seized externally (by themselves), but the sound is seized, when the lute is seized or the player of the lute; `As clouds of smoke proceed by themselves out of a lighted fire kindled with damp fuel, thus, verily, O Maitreyi, has been breathed forth from this great Being what we have as Rig-veda, Yagur-veda, Sama-veda, Atharvangirasas, Itihasa (legends), Purana (cosmogonies), Vidya (knowledge), the Upanishads, Slokas (verses), Sutras (prose rules), Anuvyakhyanas (glosses), Vyakhyanas (commentaries). From him alone all these were breathed forth. `As all waters find their centre in the sea, all"
2,4,10-12,"`As clouds of smoke proceed by themselves out of a lighted fire kindled with damp fuel, thus, verily, O Maitreyi, has been breathed forth from this great Being what we have as Rig-veda, Yagur-veda, Sama-veda, Atharvangirasas, Itihasa (legends), Purana (cosmogonies), Vidya (knowledge), the Upanishads, Slokas (verses), Sutras (prose rules), Anuvyakhyanas (glosses), Vyakhyanas (commentaries). From him alone all these were breathed forth. `As all waters find their centre in the sea, all touches in the skin, all tastes in the tongue, all smells in the nose, all colours in the eye, all sounds in the ear, all percepts in the mind, all knowledge in the heart, all actions in the hands, all movements in the feet, and all the Vedas in speech, `As a lump of salt, when thrown into water,"
2,4,11-13,"`As all waters find their centre in the sea, all touches in the skin, all tastes in the tongue, all smells in the nose, all colours in the eye, all sounds in the ear, all percepts in the mind, all knowledge in the heart, all actions in the hands, all movements in the feet, and all the Vedas in speech, `As a lump of salt, when thrown into water, becomes dissolved into water, and could not be taken out again, but wherever we taste (the water) it is salt, thus verily, O Maitreyi, does this great Being, endless, unlimited, consisting of nothing but knowledge, rise from out these elements, and vanish again in them. When he has departed, there is no more knowledge (name), I say, O Maitreyi.'Thus spoke Yagnavalkya. Then Maitreyi said: `Here thou hast bewildered"
2,4,12-13,"`As a lump of salt, when thrown into water, becomes dissolved into water, and could not be taken out again, but wherever we taste (the water) it is salt, thus verily, O Maitreyi, does this great Being, endless, unlimited, consisting of nothing but knowledge, rise from out these elements, and vanish again in them. When he has departed, there is no more knowledge (name), I say, O Maitreyi.'Thus spoke Yagnavalkya. Then Maitreyi said: `Here thou hast bewildered me, Sir, when thou sayest that having departed, there is no more knowledge.' But Yagnavalkya replied: `O Maitreyi, I say nothing that is bewildering. This is enough, O beloved, for wisdom. `For when there is as it were duality, then one sees the other, one smells the other, one hears the other, one salutes the other, one perceives the other, one knows the other; but when the Self only is all this, how should he smell another, how should he see another, how should he hear another, how should he salute another, how should he perceive another, how should he know another?_ How should he know Him by whom he knows all this? How, O beloved should he know (himself), the Knower?'"
2,5,1-3,"This earth is the honey (madhu, the effect) of all beings, and all beings are the honey (madhu, the effect) of this earth. Likewise this bright, immortal person in this earth, and that bright immortal person incorporated in the body (both are madhu). He indeed is the same as that Self, that Immortal, that Brahman, that All. This water is the honey of all beings, and all beings are the honey of this water. Likewise this bright, immortal person in this water, and that bright, immortal person, existing as seed in the body (both are madhu). He indeed is the same as that Self, that Immortal, that Brahman, that All. This fire is the honey of all beings, and all beings"
2,5,2-4,"This water is the honey of all beings, and all beings are the honey of this water. Likewise this bright, immortal person in this water, and that bright, immortal person, existing as seed in the body (both are madhu). He indeed is the same as that Self, that Immortal, that Brahman, that All. This fire is the honey of all beings, and all beings are the honey of this fire. Likewise this bright, immortal person in this fire, and that bright, immortal person, existing as speech in the body (both are madhu). He indeed is the same as that Self, that Immortal, that Brahman, that All. This air is the honey of all beings, and all beings"
2,5,3-5,"This fire is the honey of all beings, and all beings are the honey of this fire. Likewise this bright, immortal person in this fire, and that bright, immortal person, existing as speech in the body (both are madhu). He indeed is the same as that Self, that Immortal, that Brahman, that All. This air is the honey of all beings, and all beings are the honey of this air. Likewise this bright, immortal person in this air, and that bright, immortal person existing as breath in the body (both are madhu). He indeed is the same as that Self, that Immortal, that Brahman, that All. This sun is the honey of all beings, and all beings"
2,5,4-6,"This air is the honey of all beings, and all beings are the honey of this air. Likewise this bright, immortal person in this air, and that bright, immortal person existing as breath in the body (both are madhu). He indeed is the same as that Self, that Immortal, that Brahman, that All. This sun is the honey of all beings, and all beings are the honey of this sun. Likewise this bright, immortal person in this sun, and that bright, immortal person existing as the eye in the body (both are madhu). He indeed is the same as that Self, that Immortal, that Brahman, that All. This space (disah, the quarters) is the honey of all"
2,5,5-7,"This sun is the honey of all beings, and all beings are the honey of this sun. Likewise this bright, immortal person in this sun, and that bright, immortal person existing as the eye in the body (both are madhu). He indeed is the same as that Self, that Immortal, that Brahman, that All. This space (disah, the quarters) is the honey of all beings, and all beings are the honey of this space. Likewise this bright, immortal person in this space, and that bright, immortal person existing as the ear in the body (both are madhu). He indeed is the same as that Self, that Immortal, that Brahman, that All. This moon is the honey of all beings, and all"
2,5,6-8,"This space (disah, the quarters) is the honey of all beings, and all beings are the honey of this space. Likewise this bright, immortal person in this space, and that bright, immortal person existing as the ear in the body (both are madhu). He indeed is the same as that Self, that Immortal, that Brahman, that All. This moon is the honey of all beings, and all beings are the honey of this moon. Likewise this bright, immortal person in this moon, and that bright, immortal person existing as mind in the body (both are madhu). He indeed is the same as that Self, that Immortal, that Brahman, that All. This lightning is the honey of all beings, and all"
2,5,7-9,"This moon is the honey of all beings, and all beings are the honey of this moon. Likewise this bright, immortal person in this moon, and that bright, immortal person existing as mind in the body (both are madhu). He indeed is the same as that Self, that Immortal, that Brahman, that All. This lightning is the honey of all beings, and all beings are the honey of this lightning. Likewise this bright, immortal person in this lightning, and that bright, immortal person existing as light in the body (both are madhu). He indeed is the same as that Self, that Immortal, that Brahman, that All. This thunder is the honey of all beings, and all"
2,5,8-10,"This lightning is the honey of all beings, and all beings are the honey of this lightning. Likewise this bright, immortal person in this lightning, and that bright, immortal person existing as light in the body (both are madhu). He indeed is the same as that Self, that Immortal, that Brahman, that All. This thunder is the honey of all beings, and all beings are the honey of this thunder. Likewise this bright, immortal person in this thunder, and that bright, immortal person existing as sound and voice in the body (both are madhu). He indeed is the same as that Self, that Immortal, that Brahman, that All. This ether is the honey of all beings, and all"
2,5,9-11,"This thunder is the honey of all beings, and all beings are the honey of this thunder. Likewise this bright, immortal person in this thunder, and that bright, immortal person existing as sound and voice in the body (both are madhu). He indeed is the same as that Self, that Immortal, that Brahman, that All. This ether is the honey of all beings, and all beings are the honey of this ether. Likewise this bright, immortal person in this ether, and that bright, immortal person existing as heart-ether in the body (both are madhu). He indeed is the same as that Self, that Immortal, that Brahman, that All. This law (dharmah) is the honey of all beings,"
2,5,10-12,"This ether is the honey of all beings, and all beings are the honey of this ether. Likewise this bright, immortal person in this ether, and that bright, immortal person existing as heart-ether in the body (both are madhu). He indeed is the same as that Self, that Immortal, that Brahman, that All. This law (dharmah) is the honey of all beings, and all beings are the honey of this law. Likewise this bright, immortal person in this law, and that bright, immortal person existing as law in the body (both are madhu). He indeed is the same as that Self, that Immortal, that Brahman, that All. This true (satyam) is the honey of all beings, and"
2,5,11-13,"This law (dharmah) is the honey of all beings, and all beings are the honey of this law. Likewise this bright, immortal person in this law, and that bright, immortal person existing as law in the body (both are madhu). He indeed is the same as that Self, that Immortal, that Brahman, that All. This true (satyam) is the honey of all beings, and all beings are the honey of this true. Likewise this bright, immortal person in what is true, and that bright, immortal person existing as the true in the body (both are madhu). He indeed is the same as that Self, that Immortal, that Brahman, that All. This mankind is the honey of all beings, and all"
2,5,12-14,"This true (satyam) is the honey of all beings, and all beings are the honey of this true. Likewise this bright, immortal person in what is true, and that bright, immortal person existing as the true in the body (both are madhu). He indeed is the same as that Self, that Immortal, that Brahman, that All. This mankind is the honey of all beings, and all beings are the honey of this mankind. Likewise this bright, immortal person in mankind, and that bright, immortal person existing as man in the body (both are madhu). He indeed is the same as that Self, that Immortal, that Brahman, that All. This Self is the honey of all beings, and all beings"
2,5,13-15,"This mankind is the honey of all beings, and all beings are the honey of this mankind. Likewise this bright, immortal person in mankind, and that bright, immortal person existing as man in the body (both are madhu). He indeed is the same as that Self, that Immortal, that Brahman, that All. This Self is the honey of all beings, and all beings are the honey of this Self. Likewise this bright, immortal person in this Self, and that bright, immortal person, the Self (both are madhu). He indeed is the same as that Self, that Immortal, that Brahman, that All. And verily this Self is the lord of all beings, the"
2,5,14-16,"This Self is the honey of all beings, and all beings are the honey of this Self. Likewise this bright, immortal person in this Self, and that bright, immortal person, the Self (both are madhu). He indeed is the same as that Self, that Immortal, that Brahman, that All. And verily this Self is the lord of all beings, the king of all beings. And as all spokes are contained in the axle and in the felly of a wheel, all beings, and all those selfs (of the earth, water, &c.) are contained in that Self. Verily Dadhyak Atharvana proclaimed this honey"
