Chapter,Section,VerseRange,Text
1,1,1-2,"Verily the dawn is the head of the horse which is fit for sacrifice, the sun its eye, the wind its breath, the mouth the Vaisvanara fire, the year the body of the sacrificial horse. Heaven is the back, the sky the belly, the earth the chest, the quarters the two sides, the intermediate quarters the ribs, the members the seasons, the joints the months and half-months, the feet days and nights, the bones the stars, the flesh the clouds. The half-digested food is the sand, the rivers the bowels, the liver and the lungs the mountains, the hairs the herbs and trees. As the sun rises, it is the forepart, as it sets, the hindpart of the horse. When the horse shakes itself, then it lightens; when it kicks, it thunders; when it makes water, it rains; voice is its voice. Verily Day arose after the horse as the (golden) vessel, called Mahiman (greatness), which (at the sacrifice) is placed before the horse. Its place is in the Eastern sea. The Night arose after the horse as the (silver) vessel, called Mahiman, which (at the sacrifice) is placed behind the horse. Its place is in the Western sea. Verily, these two vessels (or greatnesses) arose to be on each side of the horse. As a racer he carried the Devas, as a stallion the Gandharvas, as a runner the Asuras, as a horse men. The sea is its kin, the sea is its birthplace."
1,2,1-3,"In the beginning there was nothing (to be perceived) here whatsoever. By Death indeed all this was concealed, by hunger; for death is hunger. Death (the first being) thought, `Let me have a body.' Then he moved about, worshipping. From him thus worshipping water was produced. And he said: `Verily, there appeared to me, while I worshipped (arkate), water (ka).' This is why water is called ar-ka. Surely there is water (or pleasure) for him who thus knows the reason why water is called arka. Verily water is arka. And what was there as the froth of the water, that was hardened, and became the earth. On that earth he (Death) rested, and from him, thus resting and heated, Agni (Virag) proceeded, full of light. That being divided itself threefold, Aditya (the sun)"
1,2,2-4,"Verily water is arka. And what was there as the froth of the water, that was hardened, and became the earth. On that earth he (Death) rested, and from him, thus resting and heated, Agni (Virag) proceeded, full of light. That being divided itself threefold, Aditya (the sun) as the third, and Vayu (the air) as the third. That spirit (prana) became threefold. The head was the Eastern quarter, and the arms this and that quarter (i.e. the N.E. and S.E., on the left and right sides). Then the tail was the Western quarter, and the two legs this and that quarter (i.e. the N.W. and S.W.). The sides were the Southern and Northern quarters, the back heaven, the belly the sky, the dust the earth. Thus he (Mrityu, as arka) stands firm in the water, and he who knows this stands firm wherever he goes. He desired, `Let a second body be born of me,'"
1,2,3-5,"That being divided itself threefold, Aditya (the sun) as the third, and Vayu (the air) as the third. That spirit (prana) became threefold. The head was the Eastern quarter, and the arms this and that quarter (i.e. the N.E. and S.E., on the left and right sides). Then the tail was the Western quarter, and the two legs this and that quarter (i.e. the N.W. and S.W.). The sides were the Southern and Northern quarters, the back heaven, the belly the sky, the dust the earth. Thus he (Mrityu, as arka) stands firm in the water, and he who knows this stands firm wherever he goes. He desired, `Let a second body be born of me,' and he (Death or Hunger) embraced Speech in his mind. Then the seed became the year. Before that time there was no year. Speech bore him so long as a year, and after that time sent him forth. Then when he was born, he (Death) opened his mouth, as if to swallow him. He cried Bhan! and that became speech. He thought, `If I kill him, I shall have but little food.'"
1,2,4-6,"He desired, `Let a second body be born of me,' and he (Death or Hunger) embraced Speech in his mind. Then the seed became the year. Before that time there was no year. Speech bore him so long as a year, and after that time sent him forth. Then when he was born, he (Death) opened his mouth, as if to swallow him. He cried Bhan! and that became speech. He thought, `If I kill him, I shall have but little food.' He therefore brought forth by that speech and by that body (the year) all whatsoever exists, the Rik, the Yagus, the Saman, the metres, the sacrifices, men, and animals. And whatever he (Death) brought forth, that he resolved to eat (ad). Verily because he eats everything, therefore is Aditi (Death) called Aditi. He who thus knows why Aditi is called Aditi, becomes an eater of everything, and everything becomes his food. He desired to sacrifice again with a greater"
1,2,5-7,"He thought, `If I kill him, I shall have but little food.' He therefore brought forth by that speech and by that body (the year) all whatsoever exists, the Rik, the Yagus, the Saman, the metres, the sacrifices, men, and animals. And whatever he (Death) brought forth, that he resolved to eat (ad). Verily because he eats everything, therefore is Aditi (Death) called Aditi. He who thus knows why Aditi is called Aditi, becomes an eater of everything, and everything becomes his food. He desired to sacrifice again with a greater sacrifice. He toiled and performed penance. And while he toiled and performed penance, glorious power went out of him. Verily glorious power means the senses (prana). Then when the senses had gone out, the body took to swelling (sva-yitum), and mind was in the body. He desired that this body should be fit for sacrifice"
1,2,6-7,"He desired to sacrifice again with a greater sacrifice. He toiled and performed penance. And while he toiled and performed penance, glorious power went out of him. Verily glorious power means the senses (prana). Then when the senses had gone out, the body took to swelling (sva-yitum), and mind was in the body. He desired that this body should be fit for sacrifice (medhya), and that he should be embodied by it. Then he became a horse (asva), because it swelled (asvat), and was fit for sacrifice (medhya); and this is why the horse-sacrifice is called Asva-medha. Verily he who knows him thus, knows the Asvamedha. Then, letting the horse free, he thought, and at the end of a year he offered it up for himself, while he gave up the (other) animals to the deities. Therefore the sacrificers offered up the purified horse belonging to Pragapati, (as dedicated) to all the deities. Verily the shining sun is the Asvamedha-sacrifice, and his body is the year; Agni is the sacrificial fire (arka), and these worlds are his bodies. These two are the sacrificial fire and the Asvamedha-sacrifice, and they are again one deity, viz. Death. He (who knows this) overcomes another death, death does not reach him, death is his Self, he becomes one of those deities."
1,3,1-3,"There were two kinds of descendants of Pragapati, the Devas and the Asuras. Now the Devas were indeed the younger, the Asuras the elder ones. The Devas, who were struggling in these worlds, said: `Well, let us overcome the Asuras at the sacrifices (the Gyotishtoma) by means of the udgitha.' They said to speech (Vak): `Do thou sing out for us (the udgitha).' `Yes,' said speech, and sang (the udgitha). Whatever delight there is in speech, that she obtained for the Devas by singing (the three pavamanas); but that she pronounced well (in the other nine pavamanas), that was for herself. The Asuras knew: `Verily, through this singer they will overcome us.' They therefore rushed at the singer and pierced her with evil. That evil which consists in saying what is bad, that is that evil. Then they (the Devas) said to breath (scent): `Do"
1,3,2-4,"They said to speech (Vak): `Do thou sing out for us (the udgitha).' `Yes,' said speech, and sang (the udgitha). Whatever delight there is in speech, that she obtained for the Devas by singing (the three pavamanas); but that she pronounced well (in the other nine pavamanas), that was for herself. The Asuras knew: `Verily, through this singer they will overcome us.' They therefore rushed at the singer and pierced her with evil. That evil which consists in saying what is bad, that is that evil. Then they (the Devas) said to breath (scent): `Do thou sing out for us.' `Yes,' said breath, and sang. Whatever delight there is in breath (smell), that he obtained for the Devas by singing; but that he smelled well, that was for himself. The Asuras knew: `Verily, through this singer they will overcome us.' They therefore rushed at the singer, and pierced him with evil. That evil which consists in smelling what is bad, that is that evil. Then they said to the eye: `Do thou sing out for"
1,3,3-5,"Then they (the Devas) said to breath (scent): `Do thou sing out for us.' `Yes,' said breath, and sang. Whatever delight there is in breath (smell), that he obtained for the Devas by singing; but that he smelled well, that was for himself. The Asuras knew: `Verily, through this singer they will overcome us.' They therefore rushed at the singer, and pierced him with evil. That evil which consists in smelling what is bad, that is that evil. Then they said to the eye: `Do thou sing out for us.' `Yes,' said the eye, and sang. Whatever delight there is in the eye, that he obtained for the Devas by singing; but that he saw well, that was for himself. The Asuras knew: `Verily, through this singer they will overcome us.' They therefore rushed at the singer, and pierced him with evil. That evil which consists in seeing what is bad, that is that evil. Then they said to the ear: `Do thou sing out for us.'"
1,3,4-6,"Then they said to the eye: `Do thou sing out for us.' `Yes,' said the eye, and sang. Whatever delight there is in the eye, that he obtained for the Devas by singing; but that he saw well, that was for himself. The Asuras knew: `Verily, through this singer they will overcome us.' They therefore rushed at the singer, and pierced him with evil. That evil which consists in seeing what is bad, that is that evil. Then they said to the ear: `Do thou sing out for us.' `Yes,' said the ear, and sang. Whatever delight there is in the ear, that he obtained for the Devas by singing; but that he heard well, that was for himself. The Asuras knew: `Verily, through this singer they will overcome us.' They therefore rushed at the singer, and pierced him with evil. That evil which consists in hearing what is bad, that is that evil. Then they said to the mind: `Do thou sing out for"
1,3,5-7,"Then they said to the ear: `Do thou sing out for us.' `Yes,' said the ear, and sang. Whatever delight there is in the ear, that he obtained for the Devas by singing; but that he heard well, that was for himself. The Asuras knew: `Verily, through this singer they will overcome us.' They therefore rushed at the singer, and pierced him with evil. That evil which consists in hearing what is bad, that is that evil. Then they said to the mind: `Do thou sing out for us.' `Yes,' said the mind, and sang. Whatever delight there is in the mind, that he obtained for the Devas by singing; but that he thought well, that was for himself. The Asuras knew: `Verily, through this singer they will overcome us.' They therefore rushed at the singer, and pierced him with evil. That evil which consists in thinking what is bad, that is that evil. Thus they overwhelmed these deities with evils, thus they pierced them with evil. Then they said to the breath in the mouth: `Do"
1,3,6-8,"Then they said to the mind: `Do thou sing out for us.' `Yes,' said the mind, and sang. Whatever delight there is in the mind, that he obtained for the Devas by singing; but that he thought well, that was for himself. The Asuras knew: `Verily, through this singer they will overcome us.' They therefore rushed at the singer, and pierced him with evil. That evil which consists in thinking what is bad, that is that evil. Thus they overwhelmed these deities with evils, thus they pierced them with evil. Then they said to the breath in the mouth: `Do thou sing for us.' `Yes,' said the breath, and sang. The Asuras knew: `Verily, through this singer they will overcome us.' They therefore rushed at him and pierced him with evil. Now as a ball of earth will be scattered when hitting a stone, thus they perished, scattered in all directions. Hence the Devas rose, the Asuras fell. He who knows this, rises by his self, and the enemy who hates him falls. Then they (the Devas) said: `Where was he then"
1,3,7-9,"Then they said to the breath in the mouth: `Do thou sing for us.' `Yes,' said the breath, and sang. The Asuras knew: `Verily, through this singer they will overcome us.' They therefore rushed at him and pierced him with evil. Now as a ball of earth will be scattered when hitting a stone, thus they perished, scattered in all directions. Hence the Devas rose, the Asuras fell. He who knows this, rises by his self, and the enemy who hates him falls. Then they (the Devas) said: `Where was he then who thus stuck to us?' It was (the breath) within the mouth (asye 'ntar), and therefore called Ayasya; he was the sap (rasa) of the limbs (anga), and therefore called Angirasa. That deity was called Dur, because Death was far"
1,3,8-10,"Then they (the Devas) said: `Where was he then who thus stuck to us?' It was (the breath) within the mouth (asye 'ntar), and therefore called Ayasya; he was the sap (rasa) of the limbs (anga), and therefore called Angirasa. That deity was called Dur, because Death was far (duran) from it. From him who knows this, Death is far off. That deity, after having taken away the evil of"
1,3,9-11,"That deity was called Dur, because Death was far (duran) from it. From him who knows this, Death is far off. That deity, after having taken away the evil of those deities, viz. death, sent it to where the end of the quarters of the earth is. There he deposited their sins. Therefore let no one go to a man, let no one go to the end (of the quarters of the earth), that he may not meet there with evil, with death. That deity, after having taken away the evil of"
1,3,10-12,"That deity, after having taken away the evil of those deities, viz. death, sent it to where the end of the quarters of the earth is. There he deposited their sins. Therefore let no one go to a man, let no one go to the end (of the quarters of the earth), that he may not meet there with evil, with death. That deity, after having taken away the evil of those deities, viz. death, carried them beyond death. He carried speech across first. When speech"
1,3,11-13,"That deity, after having taken away the evil of those deities, viz. death, carried them beyond death. He carried speech across first. When speech had become freed from death, it became (what it had been before) Agni (fire). That Agni, after having stepped beyond death, shines. Then he carried breath (scent) across. When"
1,3,12-14,"He carried speech across first. When speech had become freed from death, it became (what it had been before) Agni (fire). That Agni, after having stepped beyond death, shines. Then he carried breath (scent) across. When breath had become freed from death, it became Vayu (air). That Vayu, after having stepped beyond death, blows. Then he carried the eye across. When the eye"
1,3,13-15,"Then he carried breath (scent) across. When breath had become freed from death, it became Vayu (air). That Vayu, after having stepped beyond death, blows. Then he carried the eye across. When the eye had become freed from death, it became Aditya (the sun). That Aditya, after having stepped beyond death, burns. Then he carried the ear across. When the ear"
1,3,14-16,"Then he carried the eye across. When the eye had become freed from death, it became Aditya (the sun). That Aditya, after having stepped beyond death, burns. Then he carried the ear across. When the ear had become freed from death, it became the quarters (space). These are our quarters (space), which have stepped beyond death. Then he carried the mind across. When the mind"
1,3,15-17,"Then he carried the ear across. When the ear had become freed from death, it became the quarters (space). These are our quarters (space), which have stepped beyond death. Then he carried the mind across. When the mind had become freed from death, it became the moon (Kandramas). That moon, after having stepped beyond death, shines. Thus does that deity carry him, who knows this, across death. Then breath (vital), by singing, obtained for"
1,3,16-18,"Then he carried the mind across. When the mind had become freed from death, it became the moon (Kandramas). That moon, after having stepped beyond death, shines. Thus does that deity carry him, who knows this, across death. Then breath (vital), by singing, obtained for himself eatable food. For whatever food is eaten, is eaten by breath alone, and in it breath rests. The Devas said: `Verily, thus far, whatever food there is, thou hast by singing acquired it for thyself. Now therefore give us a share in that food.' He said: `You there, enter into me.' They said Yes, and entered all into him. Therefore whatever food is eaten by breath, by it the other senses are satisfied. If a man knows this, then his own relations come"
1,3,17-19,"Then breath (vital), by singing, obtained for himself eatable food. For whatever food is eaten, is eaten by breath alone, and in it breath rests. The Devas said: `Verily, thus far, whatever food there is, thou hast by singing acquired it for thyself. Now therefore give us a share in that food.' He said: `You there, enter into me.' They said Yes, and entered all into him. Therefore whatever food is eaten by breath, by it the other senses are satisfied. If a man knows this, then his own relations come to him in the same manner; he becomes their supporter, their chief leader, their strong ruler. And if ever any one tries to oppose one who is possessed of such knowledge among his own relatives, then he will not be able to support his own belongings. But he who follows the man who is possessed of such knowledge, and who with his permission wishes to support those whom he has to support, he indeed will be able to support his own belongings. He was called Ayasya Angirasa, for he is the sap"
1,3,18-20,"If a man knows this, then his own relations come to him in the same manner; he becomes their supporter, their chief leader, their strong ruler. And if ever any one tries to oppose one who is possessed of such knowledge among his own relatives, then he will not be able to support his own belongings. But he who follows the man who is possessed of such knowledge, and who with his permission wishes to support those whom he has to support, he indeed will be able to support his own belongings. He was called Ayasya Angirasa, for he is the sap (rasa) of the limbs (anga). Verily, breath is the sap of the limbs. Yes, breath is the sap of the limbs. Therefore from whatever limb breath goes away, that limb withers, for breath verily is the sap of the limbs. He (breath) is also Brihaspati, for speech is"
1,3,19-22,"He was called Ayasya Angirasa, for he is the sap (rasa) of the limbs (anga). Verily, breath is the sap of the limbs. Yes, breath is the sap of the limbs. Therefore from whatever limb breath goes away, that limb withers, for breath verily is the sap of the limbs. He (breath) is also Brihaspati, for speech is Brihati (Rig-veda), and he is her lord; therefore he is Brihaspati. Brahman (Yagur-veda), and he is her lord; He (breath) is also Saman (the Udgitha), for speech is Saman (Sama-veda), and that is both speech (sa) and breath (ama). This is why Saman is called Saman. Or because he is equal (sama) to a grub, equal"
1,3,21-23,"He (breath) is also Brihaspati, for speech is Brihati (Rig-veda), and he is her lord; therefore he is Brihaspati. Brahman (Yagur-veda), and he is her lord; He (breath) is also Saman (the Udgitha), for speech is Saman (Sama-veda), and that is both speech (sa) and breath (ama). This is why Saman is called Saman. Or because he is equal (sama) to a grub, equal to a gnat, equal to an elephant, equal to these three worlds, nay, equal to this universe, therefore he is Saman. He who thus knows this Saman, obtains union and oneness with Saman. He (breath) is Udgitha. Breath verily is Ut, for by"
1,3,22-24,"Or because he is equal (sama) to a grub, equal to a gnat, equal to an elephant, equal to these three worlds, nay, equal to this universe, therefore he is Saman. He who thus knows this Saman, obtains union and oneness with Saman. He (breath) is Udgitha. Breath verily is Ut, for by breath this universe is upheld (uttabdha); and speech is Githa, song. And because he is ut and githa, therefore he (breath) is Udgitha. And thus Brahmadatta Kaikitaneya (the grandson"
1,3,23-25,"He (breath) is Udgitha. Breath verily is Ut, for by breath this universe is upheld (uttabdha); and speech is Githa, song. And because he is ut and githa, therefore he (breath) is Udgitha. And thus Brahmadatta Kaikitaneya (the grandson of Kikitana), while taking Soma (ragan), said: `May this Soma strike my head off, if Ayasya Angirasa sang another Udgitha than this. He sang it indeed as speech and breath.' He who knows what is the property of this"
1,3,24-26,"And thus Brahmadatta Kaikitaneya (the grandson of Kikitana), while taking Soma (ragan), said: `May this Soma strike my head off, if Ayasya Angirasa sang another Udgitha than this. He sang it indeed as speech and breath.' He who knows what is the property of this Saman, obtains property. Now verily its property is tone only. Therefore let a priest, who is going to perform the sacrificial work of a Sama-singer, desire that his voice may have a good tone, and let him perform the sacrifice with a voice that is in good tone. Therefore people (who want a priest) for a sacrifice, look out for one who possesses a good voice, as for one who possesses property. He who thus knows what is the property of that Saman, obtains property. He who knows what is the gold of that Saman,"
1,3,25-27,"He who knows what is the property of this Saman, obtains property. Now verily its property is tone only. Therefore let a priest, who is going to perform the sacrificial work of a Sama-singer, desire that his voice may have a good tone, and let him perform the sacrifice with a voice that is in good tone. Therefore people (who want a priest) for a sacrifice, look out for one who possesses a good voice, as for one who possesses property. He who thus knows what is the property of that Saman, obtains property. He who knows what is the gold of that Saman, obtains gold. Now verily its gold is tone only. He who thus knows what is the gold of that Saman, obtains gold. He who knows what is the support of that Saman,"
1,3,26-28,"He who knows what is the gold of that Saman, obtains gold. Now verily its gold is tone only. He who thus knows what is the gold of that Saman, obtains gold. He who knows what is the support of that Saman, he is supported. Now verily its support is speech only. For, as supported in speech, that breath is sung as that Saman. Some say the support is in food. Next follows the Abhyaroha (the ascension) of the Pavamana verses. Verily the Prastotri begins to sing the Saman, and when he begins, then let him (the sacrificer) recite these (three Yagus-verses): `Lead me from the unreal to the real! Lead me from darkness to light! Lead me from death to immortality!' Now when he says, `Lead me from the unreal to the real,' the unreal is verily death, the real immortality. He therefore says, `Lead me from death to immortality, make me immortal.' When he says, `Lead me from darkness to light,' darkness is verily death, light immortality. He therefore says, `Lead me from death to immortality, make me immortal.' When he says, `Lead me from death to immortality,' there is nothing there, as it were, hidden (obscure, requiring explanation). Next come the other Stotras with which the priest"
1,3,27-28,"He who knows what is the support of that Saman, he is supported. Now verily its support is speech only. For, as supported in speech, that breath is sung as that Saman. Some say the support is in food. Next follows the Abhyaroha (the ascension) of the Pavamana verses. Verily the Prastotri begins to sing the Saman, and when he begins, then let him (the sacrificer) recite these (three Yagus-verses): `Lead me from the unreal to the real! Lead me from darkness to light! Lead me from death to immortality!' Now when he says, `Lead me from the unreal to the real,' the unreal is verily death, the real immortality. He therefore says, `Lead me from death to immortality, make me immortal.' When he says, `Lead me from darkness to light,' darkness is verily death, light immortality. He therefore says, `Lead me from death to immortality, make me immortal.' When he says, `Lead me from death to immortality,' there is nothing there, as it were, hidden (obscure, requiring explanation). Next come the other Stotras with which the priest may obtain food for himself by singing them. Therefore let the sacrificer, while these Stotras are being sung, ask for a boon, whatever desire he may desire. An Udgatri priest who knows this obtains by his singing whatever desire he may desire either for himself or for the sacrificer. This (knowledge) indeed is called the conqueror of the worlds. He who thus knows this Saman, for him there is no fear of his not being admitted to the worlds."
